time_published,title,summary,overall_sentiment_score,relevance_score
20250218T171000,HP Inc. Announces Acquisition of AI Capabilities from Humane to Enhance Intelligent Ecosystem,"HP Inc. is acquiring AI capabilities, including the AI platform Cosmos, technical talent, and over 300 patents, from Humane for $116 million to enhance its product innovation and create more intelligent experiences. This acquisition aims to transform HP into an ""experience-led"" company by integrating AI into new devices like PCs and printers and will establish HP IQ, a new AI innovation lab. The deal is expected to finalize by the end of February 2025.",0.491233,1.0
20250219T043430,HP just blew $116 million of your ink cartridge money to buy one of Silicon Valley's biggest flops,"HP has acquired the startup Humane for $116 million, a company whose Ai Pin product was a commercial flop and ridiculed by the public. Despite the Ai Pin selling fewer than 10,000 units and facing widespread criticism, HP's president of technology and innovation, Tuan Tran, stated that Humane's AI platform ""Cosmos"" and its engineers will accelerate HP's development of AI-powered devices like PCs and smart printers. The acquisition is viewed by the author as a tone-deaf move given Humane's controversial track record.",-0.339992,1.0
20250220T043430,HP Labs Pioneering Tomorrows Technology Today | HP® Tech Takes,"HP Labs, the research and development arm of HP, has been a driving force in technological innovation since its establishment in 1966. This article explores its history, key milestones including the invention of LEDs and the LaserJet printer, and current focus areas such as AI, sustainable technology, and quantum computing. HP Labs continues to shape industries and define the digital age through its groundbreaking contributions.",0.829597,1.0
20250227T043430,HP Says Tariffs Could Weigh on Profitability This Year,"HP Inc. reported mixed first-quarter earnings, leading to a dip in after-hours trading. The company indicated that tariffs could negatively impact its profitability throughout the year, especially given the mature personal computer market.",-0.232049,1.0
20250227T164900,"HP Inc. was proactive about the impact of tariffs, and it may be paying off","HP Inc. has proactively addressed potential tariff impacts by shifting manufacturing operations out of China and increasing inventory. The company expects over 90% of its North American products to be built outside China by the end of fiscal 2025. This strategy appears to be positively impacting its financial results, as evidenced by a jump in inventory in Q1 fiscal 2025 and beating revenue estimates.",0.427597,1.0
20250228T043430,"HP Plans Up To 2,000 Layoffs To Balance Costs Amid Tariff Unknowns","HP Inc. announced plans to lay off between 1,000 and 2,000 employees globally, aiming to save an additional $300 million as part of its ""Future Ready"" program. The company expects these cost-cutting measures, along with a restructured supply chain to reduce reliance on China for North American products, to help offset geopolitical uncertainties and fuel investments in growth areas. HP provided positive revenue and earnings guidance, reporting a 2.4 percent increase in quarterly revenue and a 5 percent rise in PC sales.",-0.193667,1.0
20250301T030837,HP Accused of Blocking Rivals to Create Printer Ink Monopoly,"A class action lawsuit filed by Milberg alleges HP Inc. created a printer ink monopoly by using ""Dynamic Security"" firmware updates to block third-party cartridges, forcing consumers to buy more expensive HP-branded ink. This conduct led to higher prices and rendered non-HP cartridges unusable, prompting calls for an injunction and damages. Similar lawsuits and fines have been levied against HP in the past regarding its firmware updates.",-0.704665,1.0
20250303T023139,"Tech layoffs 2025 update: HP, Grubhub, Autodesk, Ibotta, are the latest to cut jobs and employees","The tech sector has seen 18,397 job losses across 75 companies so far in 2025. Recent major announcements include HP planning to cut up to 2,000 workers due to a restructuring plan, and Grubhub laying off 500 employees following its acquisition by Winder. Autodesk and Ibotta have also announced job cuts, contributing to the ongoing trend of workforce reductions in the technology industry.",-0.227087,0.849301
20250303T030710,"Trade Wars Come with a Price, and Investors May Already Paying It","This article draws parallels between the McKinley Tariff Act of 1890 and present-day trade policies, arguing that tariffs, despite their stated goals, often lead to unintended consequences such as increased prices, reduced consumer confidence, and strained international relationships. Investors are advised to evaluate policies based on their actual effects, recognizing that tariffs act as a tax, create market volatility, and impact global trade dynamics. The author suggests that history shows markets prefer certainty, and past tariffs have ultimately led to real economic costs.",-0.131442,0.8018
20250305T000000,"HP, Microchip announce thousands of layoffs","Several manufacturers, including HP, Microchip Technology, Frito-Lay, CNH Industrial, and Rheem Manufacturing, have announced significant layoffs. These job cuts are attributed to corporate cost-cutting strategies and economic uncertainties, including the impact of new tariff policies. Microchip plans to cut 2,000 jobs to save up to $100 million, while HP aims to cut 1,000 to 2,000 workers to save $300 million as part of a broader restructuring.",-0.297239,0.939409
20250307T030833,"HPE stock crashes as CEO weighs in on job cuts, earnings miss, and DOGE","Hewlett Packard Enterprise (HPE) announced significant job cuts and a material warning on full-year profits after its stock crashed due to disappointing server operating margins. CEO Antonio Neri attributed the miss to aggressive discounting and inventory devaluation, impacting HPE's financial outlook and leading analysts to reduce profit estimates. Rival Dell also saw a stock dip following HPE's announcement.",-0.252016,0.640744
20250307T030837,Should You Buy HP Inc. (NYSE:HPQ) For Its Upcoming Dividend?,"HP Inc. (NYSE:HPQ) is set to go ex-dividend in four days, with a dividend payment of US$0.2894 per share. The company has a trailing yield of 3.9% and demonstrates a sustainable dividend policy, paying out 40% of earnings and 33% of free cash flow. HP has also shown consistent earnings growth, averaging 6.1% annually over the last five years, indicating a healthy prospect for continued dividend payments.",0.400962,1.0
20250317T030837,Thermal Inkjet Printing From: HP Inc.,"HP Inc. has released HP ThermaCore, a new thermal inkjet technology that aims to significantly improve coding and marking applications. This innovation boasts increased speed, precision, and throw distance, allowing manufacturers to enhance efficiency, meet global coding standards, and reduce operational costs. It also features a sustainable design, with the printhead made from 65% recycled plastic.",0.40558,1.0
20250318T030838,Introducing Breakthrough Innovations to Shape the Future of Work in Large Format Printing,"HP announced new innovations to address challenges in the large format printing industry, focusing on efficiency, versatility, and sustainability. Key introductions include the HP Latex R530 Printer for all-in-one rigid and flexible printing, the HP PrintOS Production Hub for streamlined workflows, and an industry-first AI solution for vectorization in HP Build Workspace to save time in construction documentation. These offerings are designed to help print service providers and construction companies improve operations and expand capabilities.",0.462821,1.0
20250318T112700,"""Estamos saindo de um modelo globalizado para um regionalizado"", diz CEO da HP - IT Forum","Enrique Lores, CEO da HP Inc., announced at the HP Amplify conference that the global technology market is shifting from a globalized production model to a regionalized one, driven by geopolitical changes like proposed import tariffs. HP has been adapting its supply chain for three years, with 90% of its US-bound production moving out of China by the end of its fiscal year. Additionally, Lores highlighted the accelerating impact of AI, not only in the cloud but also at the edge, and HP's focus on transforming the work experience to boost productivity and employee satisfaction.",0.199748,1.0
20250319T030837,HP settles lawsuit after killing first responder's printers,"HP Inc. has settled a class-action lawsuit alleging it blocked customers from using third-party toner cartridges through firmware updates, refusing to pay any damages to resolve the case. One plaintiff, Mobile Emergency Housing Corp, providing shelters for disaster victims, had its HP printer rendered useless by a firmware update after using cheaper third-party toner. Although HP denies wrongdoing, it has agreed to continue making disclosures about its ""Dynamic Security"" and provide users the option to decline firmware updates that include it, highlighting the ongoing conflict between HP's revenue model and consumer choice.",-0.220688,1.0
20250319T030837,"HP, Inc. President and CEO Enrique Lores Receives Inaugural JUST Capital Lifetime Achievement Award","Enrique Lores, President and CEO of HP Inc., has been honored with the inaugural JUST Capital Lifetime Achievement Award at the organization's 10th-anniversary gala. This award recognizes Lores' dedication to responsible business practices and HP's commitment to social responsibility, which has led to HP Inc. ranking second on Just Capital’s America’s Most Just Companies list. Under his leadership, HP has advanced its efforts in areas such as diversity, climate action, and digital equity, aligning business success with social impact.",0.790858,1.0
20250328T030838,Explore HP Labs’ Groundbreaking Innovations & Future Tech | HP® Tech Takes - Indonesia,"HP Labs has been a pioneering force in technology since its inception, consistently delivering industry-changing innovations from early personal computing to AI, sustainable technology, and quantum computing. The article explores HP Labs' journey, its significant achievements in printing, manufacturing, AI, and sustainability, and its future focus on AI-powered automation, sustainable hardware, quantum computing, and next-generation cybersecurity. It highlights how these innovations impact industries and society, particularly within Indonesia's dynamic and rapidly digitalizing market, empowering businesses and customers with cutting-edge solutions.",0.480491,1.0
20250401T014841,"HP and Reincubate Partner to Deliver Personalized, NPU-Based, On-Device AI Capabilities","HP Inc. and Reincubate have announced a multi-year strategic partnership to enhance on-device video and video conferencing experiences using NPU-based AI capabilities. This collaboration will leverage Reincubate's AI video technology to deliver secure, private, and efficient digital collaboration features on HP's next-generation AI PCs. The AI processing will run locally on the NPU, ensuring low latency, privacy, and improved battery life for users.",0.413338,1.0
20250403T012249,Connection Wins Two HP Inc. Partner of the Year Awards,"Connection (PC Connection, Inc.; NASDAQ: CNXN) has been honored with two HP Partner of the Year Awards: HP U.S. Commercial Supplies Partner of the Year and HP U.S. Print Hardware NSP of the Year. These awards recognize Connection's outstanding performance, collaboration, and strategic growth with HP. The company attributes this success to its strong partnership with HP and a shared focus on customer service and innovation in technology solutions.",0.377693,0.898075
20250403T014841,HP settles computer false discount class action lawsuit for $4 million,"HP Inc. has agreed to a $4 million settlement in a class action lawsuit alleging misleading discount advertising on its website for various computer products. Consumers who purchased discounted HP desktop computers, laptops, mice, or keyboards directly from HP's website between June 5, 2021, and October 28, 2024, may be eligible for a cash payment of $10 to $100 per item. The deadline to submit a claim is June 9, 2025, and payments are expected to be distributed after final approval in August 2025.",-0.229976,1.0
20250406T014841,HP Inc reinvents their regional cash flow forecasting with HSBC | Insights | HSBC,"HP Inc collaborated with HSBC to automate its regional cash flow forecasting, transitioning from manual, error-prone processes to HSBC’s Cash Flow Forecasting (CFF) tool within HSBCnet. This has significantly reduced man-hours, improved forecast accuracy, and provided real-time visibility into cash positions across five Asia Pacific markets, with plans for further expansion. The solution has led to substantial efficiency gains and received awards for its innovative approach in cash flow management.",0.425155,1.0
20250407T014841,"Marcos Razon, SVP and Division President of HP Lifecycle Services and Customer Support, HP Inc.","This page profiles Marcos Razon, the SVP and Division President of HP Lifecycle Services and Customer Support at HP Inc. It highlights his role in overseeing strategy, P&L, and a services portfolio including PC and Print Support, Configuration, and Deployment, ensuring global support across 180+ countries. The article also mentions his 30 years of experience at HP and includes a link to an article authored by him.",0.20821,0.948885
20250407T053000,HP imprime forte investimento no Brasil. Saiba o papel do País na evolução da companhia,"HP is making significant investments in Brazil, leveraging the country's operation as fundamental for its global business, which had a revenue of US$53.6 billion. The company's evolution in Brazil is driven by the adoption of AI in products, a strong focus on sustainability, and an increase in exports from local factories. Brazil plays a strategic role in HP's global supply chain and has shown double-digit growth in PC and printer sales, surpassing global averages.",0.387039,1.0
20250410T002818,Technology Alliances,"Absolute Software offers ""Technology Alliances"" that integrate its self-healing security solutions with leading cybersecurity and IT platforms. These alliances aim to ensure applications remain operational, protected, and secure by leveraging Absolute's Application Resilience and Persistence Technology to counter security gaps and software vulnerabilities. Partners benefit from enhanced security offerings, continuous protection against cyber threats, and seamless integration capabilities.",0.629979,0.829891
20250411T014841,5 Best Laptops for Online College Classes in 2024,"This article provides a comprehensive guide to selecting the best laptops for online college classes in 2025, focusing on HP models. It details key features like performance, battery life, and portability, and recommends specific HP laptops for overall use, high performance, budget constraints, 2-in-1 versatility, and portability, considering different academic majors.",0.414786,1.0
20250415T014841,HP Holiday Gift Guide 2025: Top Tech Gifts for Everyone | HP® Tech Takes SEO,"HP's 2025 Holiday Gift Guide features a wide range of tech products, including desktops, laptops, printers, monitors, and accessories, designed to suit various needs and budgets. The guide highlights specific HP and OMEN models, detailing their features and ideal users, from serious gamers and creative professionals to students and home office workers. It also offers shopping tips, such as checking for deals, protecting purchases with Care Packs, and personalizing gifts based on the recipient's preferences.",0.30749,1.0
20250416T014841,$4M HP.com misleading discounts class action settlement,"HP has agreed to a $4 million class action settlement to resolve claims of misleading discounts on its website. Consumers who purchased certain HP desktop computers, laptops, mice, and keyboards at a discount on HP.com between June 5, 2021, and October 28, 2024, are eligible to file a claim. Individual awards range from $10 to $100, subject to pro rata adjustments, and the deadline to file a claim is June 9, 2025.",-0.243515,0.929407
20250417T014841,HP Multi Jet Fusion: Revolutionizing the drone industry with 3D printed drones,"This article highlights how HP Multi Jet Fusion (MJF) technology is transforming the drone industry through enhanced customization, efficiency, and rapid prototyping. It showcases three companies—Inverto Earth, Frameworks Robotics, and UAV Works—that leveraged HP MJF to innovate sustainable mangrove planting drones, modular underwater vehicles, and high-performance aerial systems. The technology offers benefits such as design freedom, durability, on-demand production, and weight optimization, proving to be a game-changer for both UAVs and UUVs.",0.489062,1.0
20250419T080300,Elliott Management takes a stake in Hewlett Packard Enterprise. How the firm may create value,"Elliott Management has taken a $1.5 billion stake in Hewlett Packard Enterprise (HPE), seeing significant undervaluation due to poor execution and a pending acquisition of Juniper Networks. The activist investor believes its involvement, potentially through board representation, can restore shareholder confidence and ensure value creation regardless of the Juniper acquisition's outcome, leveraging its strong track record in tech activism. HPE's diverse portfolio, especially its high-multiple networking business, positions it favorably against competitors and potential geopolitical headwinds.",0.075296,0.562829
20250421T000703,"Capital Group, Dimensional Top Active ETF Inflows Amid Volatility","During a period of market volatility in early April, investors funneled $2.4 billion into US large-cap active ETFs, with Capital Group leading the inflows. The firm's Dividend Value ETF alone attracted about $648 million, while Dimensional Fund Advisors also saw significant inflows. Despite the active ETF growth, passive US large-cap ETFs still attracted a much larger $20.2 billion during the same timeframe.",-0.088092,0.560045
20250422T010137,AstroNova to launch digital label presses and direct-to-package printer at FESPA 2025,"AstroNova plans to introduce two new digital label presses, the QL-425 and QL-435, and a direct-to-package printer, the VP-800, at FESPA Global Print Expo 2025. These new offerings are designed to provide speed, flexibility, and cost-efficiency for the light to medium production segment, targeting label converters, brand-owners, and print service providers. The company emphasizes greater control, increased uptime, and lower operating costs through advanced hardware and intelligent automation.",0.307638,0.629886
20250422T014841,MediaTek and HP bring educational Chromebooks to EDIX Tokyo 2025,"MediaTek and HP are showcasing the new HP Fortis Flip G1m 11 Chromebook, powered by the MediaTek Kompanio 520 processor, at EDIX Tokyo 2025. This collaboration aims to provide K-12 students in Japan with powerful, efficient, and versatile educational tools, supporting the country's GIGA program. The Chromebook offers enhanced performance, extended battery life, and multitasking capabilities designed to improve digital learning experiences.",0.31441,1.0
20250430T014841,Scuderia Ferrari and HP Fuse Technology and Design with Special Livery for Miami Grand Prix,"Scuderia Ferrari and HP have unveiled a special co-designed livery for the Miami Grand Prix, celebrating the first year of their title partnership. This innovative design combines Ferrari red with HP's white and electric blue, utilizing new co-engineered technologies for visual and performance enhancements, including lighter and thinner car wraps. The collaboration also extends to optimizing Ferrari's working environment in Maranello and at the track with HP technology.",0.426242,0.916248
20250505T054400,NETGEAR Opens Software Development Center in Chennai,"NETGEAR Inc. has announced the opening of a new software development center in Chennai, India, to enhance its AI and cloud-based solutions for advanced business connectivity. This initiative is part of a larger R&D investment aimed at developing next-generation networking solutions that prioritize simplicity, reliability, and cost-effectiveness. The Chennai center was established through the acquisition of talent and IP assets from local cloud software company VAAG Systems, whose team will focus on integrating AI for end-to-end network troubleshooting.",0.196869,0.639364
20250505T080600,"HP Inc.: A Bet On Efficiency, Innovation, And Aggressive Capital Return (NYSE:HPQ)","HP Inc. is refocusing on high-margin products and corporate services, leveraging AI, premium PCs, and cloud solutions to improve profitability. Despite a stagnant market, the company generates strong free cash flow and returns capital to shareholders through buybacks and dividends, making it a stable investment. HPQ is currently undervalued compared to historical and peer metrics, presenting a buying opportunity with a fair valuation of $30.16 and a potential 20.72% total return, despite risks like US tariff policies and market competition.",0.223863,1.0
20250506T002030,Dye Sublimation Printing Market Is Now Valued at $16 Billion,"The global dye sublimation printing market is projected to reach $16 billion, driven by increasing demand for customized apparel and promotional merchandise, especially from small businesses and e-commerce. The market is expected to grow at a CAGR of 11.3% to $28.0 billion by 2030, with textile manufacturing advancements in the Asia Pacific region and the development of eco-friendly, hybrid printing technologies being key growth factors. Challenges exist with natural fibers, but innovation in inks, printers, and direct-to-fabric techniques continue to expand market applications.",0.184356,0.74036
20250517T030900,"HP Inc: Undervalued, But Don't Expect Too Much Growth","HP Inc. is considered a market leader in laptops and printers, yet faces slow growth prospects in these industries. Despite stagnant revenue and net income over the past five years, the company's valuation appears attractive, offering decent upside potential due to its stable recurring revenue from high-margin ink sales and diversified global presence. The author rates HP as a ""BUY"" for value-oriented investors seeking lower risk and steady returns through dividends, though future growth is expected to be very modest.",0.285186,1.0
20250518T003126,NVIDIA Launches AI-First DGX Personal Computing Systems With Global Computer Makers,"NVIDIA has announced new DGX Spark and DGX Station personal AI supercomputers, built by leading manufacturers like Acer, ASUS, Dell Technologies, GIGABYTE, HP, Lenovo, and MSI. These systems are designed to offer unprecedented AI performance and efficiency for developers, researchers, and data scientists, addressing the growing demand for robust AI computing solutions that can handle agentic AI systems. Powered by NVIDIA Grace Blackwell platforms, they enable prototyping, fine-tuning, and inference of models from desktop to data center, with DGX Spark available in July and DGX Station later this year.",0.319493,0.714289
20250528T001021,HPQ Earnings: All you need to know about HP’s Q2 2025 earnings results,"HP Inc. (HPQ) reported its second-quarter 2025 earnings, with net revenue up 3.3% year-over-year to $13.2 billion, beating estimates, while net earnings and GAAP/adjusted EPS decreased. The company lowered its fiscal year 2025 outlook, leading to a 15% stock plunge in aftermarket hours.",-0.496046,1.0
20250528T003538,Leading Global Manufacturer Requests HPQ’s First Batch of Fumed Silica for Evaluation,"HPQ Silicon Inc. announced that a leading global fumed silica manufacturer has requested early samples of their fumed silica, generated using HPQ's proprietary Fumed Silica Reactor (FSR) Pilot Plant. This early interest follows independent validation of HPQ Silica Polvere Inc.'s fumed silica production. The collaboration aims to accelerate the pilot plant program by enhancing product-grade purity and reaching a targeted production capacity of 50 tonnes per year, ultimately accelerating market entry for HPQ's scalable, high-purity fumed silica solution.",0.369896,1.0
20250529T020851,HP Inc caiu mais de 8% na quinta-feira após cortar previsão de lucro e reforçar saída da China,"As ações da HP Inc. (NYSE:HPQ) e da BDR (BOV:HPQB34) caíram significativamente após a empresa divulgar uma previsão de lucro abaixo do esperado e reduzir sua projeção anual, citando tarifas elevadas e uma economia mais fraca. A HP Inc. também confirmou a aceleração de sua retirada da China, com a produção sendo realocada para países como Vietnã, Índia, México e Estados Unidos para mitigar os impactos tarifários.",-0.413067,1.0
20250529T174000,Watch These HP Price Levels as Stock Tumbles After Company Cuts Outlook Due to Tariffs,"HP (HPQ) shares tumbled after the company missed profit expectations and issued a weak outlook, attributing this to increased tariff costs. The stock had already broken down from a rising wedge pattern before the announcement. Investors should monitor key support levels at $25, $23, and $21, and a key overhead resistance level near $29.",-0.637514,1.0
20250530T091000,HP Inc. Q2 Earnings: Why I Am Not Buying After The Dip (NYSE:HPQ),"HP Inc.'s Q2 FY 2025 earnings fell short of expectations, impacted by tariffs and a weak printing segment, despite growth in personal systems. While management is working to mitigate tariff effects and improve cost savings, the author remains cautious due to potential tariff-related volatility, limited margin, and high SG&A expenses. Despite an attractive valuation, the author suggests selling put options as a potentially safer long strategy than directly buying HPQ shares.",-0.343831,0.982891
