time_published,title,summary,overall_sentiment_score,relevance_score
20220103T155732,Living With a Dell Latitude 9420 2-in-1,"Michael J. Miller reviews the Dell Latitude 9420 2-in-1, a premium enterprise convertible laptop designed for demanding customers. He details its features, performance, battery life, and Dell Optimizer software, noting its solid build and strong performance despite a few minor reservations. The article concludes that it is one of the best 2-in-1 laptops he has seen.",0.194412,0.587906
20220104T152708,HP at CES 2022: Unlocking the Power of Hybrid Work Experiences with Intelligent Collaboration and Creation Technology,"HP announced new devices and solutions at CES 2022 aimed at enhancing collaboration and creation for hybrid work environments. Key introductions include the HP Elite Dragonfly G3 and HP Elite Dragonfly Chromebook for mobile professionals, new E-Series Conferencing Monitors, and powerful HP ENVY Desktops and Z2 Mini Workstations for creators. These products emphasize premium audio/video, security, and performance to adapt to distributed workforces.",0.019093,0.305233
20220104T152709,HP at CES 2022: Designing the Next Steps in Gaming with Revolutionary Experiences for All,"HP announced its latest gaming lineup at CES 2022, featuring the OMEN 45L Desktop with a new OMEN Cryo Chamber™ cooling solution, and the debut of the Victus by HP 15L Desktop. The company also unveiled the OMEN 27u 4K Gaming Monitor, designed for next-gen consoles, and updated its OMEN 16 and 17 Laptops. Additionally, HP introduced a comprehensive gaming ecosystem coverage plan to protect players' devices.",0.007362,0.307287
20220105T180829,Miro Raises $400M in Series C Funding Round to Accelerate Innovation Through Visual Collaboration in the New Hybrid Workplace,"Miro, an online platform for visual collaboration, has closed a $400M Series C funding round, bringing its total funding to $476M and valuing the company at $17.5B. This investment will fuel product development and global expansion as Miro aims to further support organizations in unlocking creativity and strengthening collaboration in the new hybrid workplace. The company has seen significant growth since its Series B round in April 2020, increasing its user base to 30M and working with 99% of Fortune 100 companies.",0.273643,0.628451
20220106T110200,"HP OMEN reveals products for 2022, including the unique cooling device, the OMEN Cryo Chamber","HP OMEN has unveiled its 2022 gaming lineup, featuring the OMEN 45L Desktop with the innovative OMEN Cryo Chamber CPU cooling solution, which significantly lowers temperatures. The lineup also includes the OMEN 25L Desktop, the compact Victus by HP 15L Desktop, and the OMEN 27u 4K Gaming Monitor, designed for next-gen consoles. These new products offer advanced performance, cooling, and customization options for a diverse gaming audience.",0.320835,1.0
20220106T152708,HP OfficeJet Pro 9012e review: Jack of all trades,"The HP OfficeJet Pro 9012e is a feature-packed all-in-one printer aimed at the small office/home office (SOHO) market, offering cloud integration and an intuitive touchscreen. While it boasts impressive features like Instant Ink and various smart capabilities, its performance is hampered by slow printing speeds, noise, and potential glitches, particularly with larger documents and Windows 11. The review concludes that despite its many functions, the 9012e struggles to excel in any single area, making it less appealing given its price point when compared to competitors and even other HP models.",-0.240755,1.0
20220107T152800,"CES 2022: HP shows off Elite Dragonfly G3, Dragonfly Chromebook and lots more new hardware","At CES 2022, HP unveiled a comprehensive portfolio targeting the hybrid-work market, including the Elite Dragonfly G3, Dragonfly Chromebook, and several new monitors, laptops, and desktop PCs. The new Elite Dragonfly G3 is a premium ultraportable laptop with a 13.5-inch screen and 12th-gen Intel Core processors, while the Dragonfly Chromebook offers a Chrome OS alternative with unique features like a haptic trackpad. HP also introduced various conferencing and webcam monitors, updated EliteBook and ProBook business laptops, and new desktop PCs and curved displays for creators.",0.334681,1.0
20220111T152709,HP Spectre x360 16 (2021) review: A high-quality 16-inch convertible with a superb OLED screen,"The HP Spectre x360 16 (2021) is a 16-inch convertible laptop featuring an 11th-gen Intel Core i7 processor and discrete Nvidia GeForce RTX 3050 graphics, along with a stunning UHD+ OLED touchscreen. While it offers powerful performance and excellent audio, its 2.01kg weight makes it unwieldy in tablet mode, and the 512GB SSD is considered insufficient for its premium price. The battery life is moderate, offering about 6 hours of mixed use before needing a recharge.",0.160315,1.0
20220113T152709,Dell Overthrows HP As PC Market Share Leader In US: Gartner,"Dell surpassed HP to become the PC shipment market leader in the U.S. during the fourth quarter of 2021, according to new data from Gartner. Overall, the U.S. PC market saw a significant 24 percent year-over-year decrease in shipments, largely due to declining Chromebook demand and ongoing supply chain issues. While global shipments also dropped by 5 percent, Dell's relatively modest decline compared to competitors allowed it to capture the top spot with a 28.5% market share.",0.014113,0.33067
20220114T150838,DevOps Tool Market 2022 Outstanding Growth Scope Witnessed,"The global DevOps Tool market is projected to reach USD 6881.6 million by 2026, growing from USD 4092.1 million in 2020 at a CAGR of 13.9% over five years. This report by Infinity Business Insights analyzes key players, market trends, and the impact of COVID-19, providing insights for investors and businesses to achieve market growth. The study covers product types like DevOps Ready, Enabled, and Capable, and applications across various sectors including IT, Telecom, BFSI, and Government.",0.330648,0.580921
20220114T152709,9 Best HP Laptops for Students,"This article provides a comprehensive guide to the best HP laptops for students, catering to various academic needs, interests, and budgets. It highlights nine different HP laptop families and models, ranging from versatile daily-use laptops like the HP Pavilion and ENVY series to specialized devices for creative fields (HP ZBook Studio) and gaming (HP OMEN), as well as affordable entry-level options like HP Chromebooks and the HP Stream 11. The article also mentions HP student discounts and emphasizes the importance of choosing a laptop that can adapt to a student's evolving needs throughout their higher education.",0.447169,1.0
20220121T095800,HP protects the planet by turning cartridge plastics into products,"HP is implementing a free recycling program called Planet Partners, allowing customers to mail back empty ink and toner cartridges to be recycled into new HP products. This initiative is part of HP's broader sustainability efforts, aiming to reduce plastic waste, with plans to divert 25,000 metric tons of ocean-bound plastic by the end of 2025. The company emphasizes its commitment by incorporating significant amounts of post-consumer recycled plastics into its ink and toner cartridges and offers products like the HP Envy Inspire 7224e, which is made from over 45% recycled plastic.",0.435538,1.0
20220127T153400,Instant Ump: HP Inc's subscription ink services hiking prices from next month,"HP is increasing the UK prices for its Instant Ink subscription service for specific tiers, with some customers facing hikes of over 50%. The price changes, effective February 26, 2022, primarily impact the ""Occasional"" and ""Moderate"" plans. While HP attributes the adjustments to market conditions, some customers are displeased and the company has not publicly detailed its pricing strategy.",-0.08924,0.988672
20220128T152659,HP wins multibillion-dollar fraud case over Autonomy sale,"Hewlett Packard (HP) has won a multibillion-dollar fraud case against the founders of the British software company Autonomy. HP sued Autonomy founder Mike Lynch and former CFO Sushovan Hussain, alleging they inflated Autonomy's revenues before its 2011 sale to HP for $11bn. This ruling comes as the UK's Home Secretary decides on Lynch's extradition to the US for separate criminal fraud charges.",0.425457,0.820898
20220131T152709,HP Envy Inspire 7955e All-in-One Printer Review,"The HP Envy Inspire 7955e All-in-One Printer is reviewed as a suitable option for families and home offices, especially if users sign up for the HP Plus plan which includes six months of free Instant Ink. While its initial purchase price is noted as somewhat high and print speeds are sluggish, the low running costs facilitated by the Instant Ink subscription and solid print quality are considered key advantages. The review highlights its two-cartridge ink design as a drawback but acknowledges its strong photo output capabilities for an entry-level consumer printer.",-0.147868,1.0
20220201T143543,Companies Choose SAP to Reduce Supply Chain Risk,"SAP announced that hundreds of companies globally, including HP Inc. and Unilever, adopted SAP Ariba and SAP Fieldglass solutions in Q4 2021 to digitalize procurement and external workforce management. This move aims to enhance supply chain resilience and gain competitive advantages amid ongoing disruptions. Key customer examples like Chobani, HP Inc., and Twining & Co. highlight how these solutions help automate processes, improve supplier relationships, and ensure supply chain reliability.",0.330162,0.920762
20220202T132500,'There is no planet B' - HP's Mariona Company on the acquisition of Choose Packaging,"HP's Mariona Company discusses the company's acquisition of Choose Packaging, emphasizing HP's commitment to disrupting the $10 billion fibre-based sustainable packaging market. The acquisition aims to leverage HP's 3D printing tooling technology to scale Choose Packaging's zero-plastic paper bottle, offering a plastic-free alternative for food and beverage, household, and cosmetics industries. HP's long-term vision is to integrate Choose Packaging's agility with HP's scaling capabilities to create a new category of sustainable packaging.",0.473693,0.995897
20220202T165709,HP puts focus on packaging with acquisition of paper bottle firm Choose,"HP has acquired Scottish paper bottle manufacturer Choose Packaging for an undisclosed fee, marking its direct entry into the packaging market. Choose Packaging specializes in commercially available zero-plastic paper bottles, aiming to disrupt the single-use plastics market. This acquisition aligns with HP's sustainability goals and its existing 3D printing-enabled Molded Fiber Tooling Solution.",0.240176,1.0
20220203T143543,HP plans to use 3D printing to help eliminate single-use PET packaging,"HP Inc. has acquired Choose Packaging, a company that developed a zero-plastic paper bottle, to combat single-use PET packaging. HP plans to leverage its 3D printing-enabled Molded Fiber Tooling Solution to scale Choose Packaging's technology globally. This initiative aims to disrupt the $10 billion fiber-based sustainable packaging market by offering a plastic-free alternative for various liquid products.",0.449172,1.0
20220203T165708,HP acquires plastic-free packaging company Choose Packaging,"HP has acquired Choose Packaging, a company specializing in zero-plastic paper bottles, to enhance its sustainable packaging capabilities and drive its broader sustainability goals. Choose Packaging's patented technology uses naturally occurring and non-toxic materials for bottle production. This acquisition will integrate Choose into HP's Personalisation and 3D Printing business to scale its technology and market presence.",0.210989,0.958021
20220204T141443,"Apple, Broadcom win new trial in $1.1 bln Caltech patent case","A U.S. appeals court has invalidated a $1.1 billion jury verdict against Apple and Broadcom in a patent infringement case brought by the California Institute of Technology (Caltech). The court deemed the damages ""legally unsupportable"" and ordered a new trial on the amount of damages, while upholding the infringement findings for two of Caltech's patents. The case revolves around Caltech's Wi-Fi technology patents used in millions of Apple devices containing Broadcom chips.",-0.12051,0.627293
20220204T143543,HP makes Scottish packaging acquisition,"HP Inc has acquired Scottish plastic-free bottle manufacturer Choose Packaging to enhance its sustainable packaging offerings. Choose Packaging developed a patented, commercially available zero-plastic paper bottle capable of holding various liquid products. This acquisition aligns with HP's sustainability goals and aims to scale Choose's technology globally.",0.416408,1.0
20220206T093000,HP DeskJet Ink Advantage Ultra 4826 review: A no-nonsense printer that effectively helps your WFH producti,"This review covers the HP DeskJet Ink Advantage Ultra 4826 printer, highlighting its suitability for home and small office use, especially for those working from home. Priced at Rs. 10,279, it comes with two full cartridge sets capable of printing up to 2,600 mono and 1,400 color pages. The article praises its effective functionality, scanning capabilities, and compatibility with various operating systems, despite occasional Wi-Fi connectivity issues.",0.233292,0.912863
20220210T143543,HP Expands Sustainability Program With Focus On Partners,"HP is expanding its sustainability program, Amplify Impact, with a strong focus on partners, as customer demand for sustainable companies grows. The program generated $3.5 billion in sales in fiscal year 2021 and aims to increase partner participation. HP's global channel chief, Kobi Elbaz, emphasizes that the initiative helps partners become more sustainable and aligns with the company's goal of being the most sustainable in the world.",0.457222,1.0
20220210T143543,"HP Accelerates Partner Sustainability Programing Centered on Climate Action, Human Rights and Digital Equity","HP Inc. has expanded its Amplify Impact program to 24 additional countries, making it available in 43 nations globally. This program aims to engage over 10,000 partners in driving positive change related to Climate Action, Human Rights, and Digital Equity. HP's commitment to sustainability efforts led to over $3.5 billion in new sales in fiscal year 2021, and the company is working towards enrolling 50% of its Amplify partners by 2025.",0.415732,1.0
20220212T165709,HP Inc. appoints Neil MacDonald as UK & Ireland Channel Director,"HP Inc. has appointed Neil MacDonald as its new UK & Ireland Channel Director. In this role, MacDonald will be responsible for the company's go-to-market strategy, sales performance across print, personal systems, services, and solutions, and managing relationships with channel partners. He brings 12 years of experience at HP, previously serving as Director of E-Commerce and Omni Channel in EMEA.",0.444475,1.0
20220214T154600,Federal prosecutors say a former HP worker scammed the company out of $4.8M and used it to buy a Tesla,"Federal prosecutors have accused Shelbee Szeto, a former HP employee, of scamming the company out of $4.8 million. Szeto allegedly routed corporate money to her personal bank account and used it to purchase luxury items including a Tesla, jewelry, and handbags. The complaint was filed on Friday, February 11, 2022.",-0.215765,1.0
20220216T193300,Hewlett Packard Enterprise set to move into its new global headquarters in Spring,"Hewlett Packard Enterprise (HPE) is opening its new global headquarters in Spring, north of Houston, as construction on its 440,000 square-foot campus wraps up. Employees have begun voluntarily moving into the space, which is expected to serve as a collaborative cultural center for its 2,200 Houston-area employees. This move from California, announced in December 2020, solidifies City Place as a growing corporate hub with significant ongoing residential and commercial development.",0.207206,0.619686
20220217T143543,"Peacock’s Newest Streaming Entry Is Dramatic, Complex and a Commercial","Peacock is debuting ""Unlocked,"" a short film created by HP Inc. and Giant Spoon, which blends cinematic storytelling with advanced product placement. The film, about data scientists searching for a rare plant, aims to engage viewers who typically avoid ads while showcasing HP's Z by HP technology. This initiative highlights NBCUniversal's strategy to integrate advertising into streaming content in less intrusive ways.",0.015392,0.323584
20220218T143543,HP’s Luciana Broggi Will Have ‘Big Shoes to Fill’ After Schell Departure,"Luciana Broggi has been named acting chief commercial officer at HP, stepping into the role previously held by Christoph Schell, who is departing for Intel. Broggi, a 30-year HP veteran and former global channel chief, faces the challenge of managing supply chain issues and maintaining strong partner relations. Channel partners express a desire for Broggi to become the permanent replacement to ensure business continuity.",0.012518,1.0
20220219T143543,How cheap ink cartridges can cost you dear,"This article discusses how HP firmware updates can render printers unusable if third-party ink cartridges are detected, frustrating users like Dom Smith who bought cheaper alternatives. HP defends this practice by citing intellectual property protection and counterfeit reduction, while third-party suppliers offer guarantees against such issues. The dispute highlights the ongoing conflict between printer manufacturers and consumers seeking more affordable ink options.",0.000437,0.346988
20220224T165709,"HP Deskjet Ink Advantage Ultra 4826 AIO review: Modern printer, good for home and basic office use","This review examines the HP Deskjet Ink Advantage Ultra 4826 AIO printer, focusing on its design, performance, and value for money. The article highlights its modern aesthetics, ease of setup, and economical printing costs due to affordable ink cartridges. While praising its print quality at high settings, the review notes slower print speeds as a drawback.",-0.070805,1.0
20220228T161700,"HP CEO says we’re still in a PC boom, and his company’s record sales prove it","HP Inc. reported strong fiscal first-quarter results, showing a significant increase in personal computer sales and overall revenue. CEO Enrique Lores stated that the PC market is $200 billion larger than pre-pandemic, driven by hybrid work and leisure, confirming an ongoing PC boom with no immediate end. The company also provided strong guidance for the fiscal year, indicating continued growth.",0.620182,0.963296
20220228T172200,"Seagate Technology Holdings PLC stock falls Monday, underperforms market","Seagate Technology Holdings PLC (STX) shares fell 1.66% on Monday, closing at $103.16. This decline occurred during a generally grim trading session for the stock market, with the S&P 500 and Dow Jones also experiencing drops. The stock traded below its 52-week high and showed mixed performance compared to competitors like Microsoft Corp. (MSFT), HP Inc. (HPQ), and Western Digital Corp. (WDC).",-0.122615,0.637804
20220301T134216,HP Hits Russia With U.S.-Backed Shipment Ban,"HP Inc. has suspended product shipments to Russia as part of U.S. sanctions following the invasion of Ukraine. CEO Enrique Lores stated the company is preparing for various scenarios, noting that the conflict adds to existing supply chain issues, particularly impacting their print business. While HP ended shipping routes through the affected region last year, the broader tech industry could face challenges due to Russia's palladium and Ukraine's neon gas supplies, critical for chip manufacturing.",-0.200229,1.0
20220303T134300,HP launches ink subscription plan for Singapore that will cut printing cost by half,"HP has launched Singapore's first printer ink-cartridge subscription service, HP Instant Ink, aiming to cut printing costs by up to 50% for home users. The service, which automatically delivers new cartridges when ink runs low, is a response to increased printing demands due to hybrid work and home-based learning. It also includes a recycling program for used cartridges through pre-paid envelopes.",0.42753,1.0
20220304T134216,HP Sustainable Impact: How More Sustainable Choices Can Help the Earth,"HP has long-standing commitments to sustainability, dating back to 1966 with recycling efforts and formally establishing HP Planet Partners in 1991. The company's sustainable impact goals are structured around three pillars—Planet, People, and Community—and align with 11 of the 17 UN Sustainable Development Goals. HP aims to reduce its environmental footprint through initiatives like eliminating single-use plastics, recycling hardware, and using ocean-bound plastics in its products, while also empowering workers and fostering educational opportunities in communities.",0.494956,1.0
20220310T134216,"HP Indigo and The Hershey Company Bring Women's Stories to Life, One Chocolate Bar at a Time","The Hershey Company, in collaboration with HP Indigo, is celebrating women's achievements globally through its #HerShe campaign for the third consecutive year. Using HP Indigo 20000 digital presses, special edition chocolate bar packaging features artwork and QR codes that highlight female talent and contributions across various fields. This initiative leverages digitally printed packaging to drive brand engagement and cultural relevance, turning the chocolate bar into a vehicle for storytelling and supporting gender equality.",0.441649,1.0
20220311T165708,The Importance of Ink Cartridge Recycling,"This article discusses the environmental benefits of recycling ink cartridges, highlighting HP's closed-loop recycling program, Planet Partners. It explains how recycling helps reduce plastic waste, supports communities, and ensures the use of quality OEM products. The article also provides multiple convenient methods for consumers to recycle their used HP ink cartridges.",0.215477,1.0
20220314T170604,HP and Hershey bring women’s stories to life,"The Hershey Company has partnered with HP Indigo for the third year of its #HerShe campaign, using digital printing to transform chocolate bar packaging into a celebration of women. The campaign, which includes a QR code on packaging leading to stories of female achievements, aims to promote gender equality and elevate brand engagement through storytelling. HP and Hershey emphasize the power of digitally printed packaging to connect with consumers and highlight diverse perspectives.",0.388233,0.842193
20220323T165708,Hundreds of HP printers affected by critical security issues,"HP has issued two security bulletins detailing critical security issues affecting hundreds of its printer models. Some models have firmware updates available to patch these vulnerabilities, while others are provided with mitigation instructions. HP advises customers to update firmware or apply workarounds immediately to protect systems and data.",-0.175601,1.0
20220323T210400,Ex-HP Executive Pleads Guilty To Defrauding Silicon Valley Company Out Of $5 Million,"A former HP, Inc. executive assistant and finance planning manager, Shelbee Szeto, pleaded guilty to defrauding the company out of approximately $5 million. Szeto used the stolen funds to purchase luxury items like cars, jewelry, and handbags by sending company payments to phony merchant accounts she set up. She faces a potential sentence of 10 years in prison and a $250,000 fine for money laundering.",-0.14087,1.0
20220324T094100,Ex-HP Executive Pleads Guilty to $5 Million Fraud Scheme,"A former HP Inc. executive, Shelbee Szeto, pleaded guilty to wire fraud, money laundering, and a related tax charge for stealing approximately $5 million from the company. Szeto, a former executive assistant and finance planning manager, created phony merchant accounts to divert funds intended for business expenses, which she then used to purchase luxury goods including cars, jewelry, and high-end accessories. She is scheduled for sentencing in July and faces a potential 10-year prison sentence and a $250,000 fine.",-0.152909,1.0
20220324T191100,HP finance manager went on $5m personal spending spree with company card,"Shelbee Szeto, a former HP finance planning manager, pleaded guilty to wire fraud, money laundering, and filing false tax returns after misappropriating approximately $5.2 million from the company. Szeto used company PCards to make payments to her own merchant accounts, then spent the funds on luxury items like Tesla and Porsche vehicles, high-end bags, and jewelry. Her sentencing is scheduled for July 20, 2022.",-0.148844,0.929976
20220328T153300,HP seeks to ride hybrid work boom with $1.7 billion Poly buyout,"HP Inc announced its intention to acquire audio and video devices maker Poly for $1.7 billion in cash, aiming to leverage the growing demand for electronic products driven by hybrid work models. The deal, valued at $3.3 billion including debt, is expected to position HP for long-term growth and is anticipated to close by the end of 2022. Poly's shares surged following the announcement, while HP's shares saw a slight decline in premarket trading.",-0.055904,1.0
20220328T165706,Wilson Sonsini Represents Poly in $3.3 Billion Acquisition by HP Inc.,"Wilson Sonsini Goodrich & Rosati is representing Poly in its acquisition by HP Inc. for $3.3 billion. The all-cash transaction for $40 per share aims to accelerate HP's strategy in hybrid work solutions and strengthen its peripherals and workforce solutions businesses. This acquisition builds on a multi-decade relationship between Poly and Wilson Sonsini, with a comprehensive legal team advising on the deal.",0.365646,1.0
