time_published,title,summary,overall_sentiment_score,relevance_score
20251110T141400,Inside HP’s plan to build the Middle East’s next generation of tech creators,"HP is implementing strategic initiatives across the Middle East and North Africa (MENA) region to empower young people, especially women, with digital skills for real-world careers. Through programs like Gaming Garages, AI mentorships, and partnerships with educational institutions and organizations, HP aims to bridge the gap between academic learning and industry experience. The company's strategy focuses on inclusivity, hands-on learning, and aligning with national digital transformation goals to foster a new generation of tech creators and entrepreneurs.",0.331808,1.0
20251110T163618,HP Inc (Hewlett Packard's) net earnings from 1998 to 2024,"This article details HP Inc.'s net earnings from 1998 to 2024, highlighting a significant dip in 2012 due to a company split and subsequent business model changes. It discusses HP Inc.'s shift to a Device as a Service (DaaS) model, acquisitions like Samsung's printer segment, and investments in 3D printing technology to maintain its market leadership. A table illustrates the yearly net earnings in billion U.S. dollars.",0.139192,1.0
20251111T081611,"Acadian Asset Management LLC Purchases 348,098 Shares of HP Inc. $HPQ","Acadian Asset Management LLC increased its stake in HP Inc. by 40.3% in the second quarter, acquiring an additional 348,098 shares, bringing its total holdings to 1,211,762 shares valued at $29,635,000. Other institutional investors also adjusted their positions in HP. The article also details recent insider stock sales, HP's stock performance, latest earnings results, and current analyst ratings and price targets for the company.",0.056137,0.996852
20251111T204622,HP Inc. Stock Underperforms Monday When Compared To Competitors,"This article reports on HP Inc.'s stock underperformance on Monday compared to its competitors. It also includes partial financial results for Unity Software (U.US) from its fourth-quarter earnings report, noting revenue increased 35% year-over-year to $609 million, beating estimates, despite a quarterly loss of 66 cents per share. The full article content regarding HP Inc.'s specific performance details is not provided.",-0.437949,1.0
20251114T000923,ERISA Case Against WPP Group USA Dismissed,"A federal judge has dismissed a complaint against WPP Group USA, ruling that the company did not misuse employee forfeitures by using them to offset future employer contributions rather than to directly benefit plan participants or cover administrative costs. The court found that WPP's plan documents allowed for this discretion, and the plaintiffs failed to prove ERISA violations. This dismissal reinforces a trend of mixed outcomes in forfeiture cases, often aligning with the Department of Labor's stance favoring employer discretion.",0.142862,0.615264
20251116T124033,HP Inc. $HPQ Stake Lifted by Geode Capital Management LLC,"Geode Capital Management LLC significantly increased its stake in HP Inc. during the second quarter, boosting its holdings to over 26 million shares. This comes amidst notable insider selling from top executives, including CEO Enrique Lores. Analysts maintain a ""Hold"" rating on HP, with a consensus target price of $28.67, following recent earnings that met expectations.",-0.120667,1.0
20251116T124033,Forsta AP Fonden Cuts Stock Position in HP Inc. $HPQ,"Forsta AP Fonden significantly reduced its stake in HP Inc. by 42.3% in Q2 2025, selling 145,000 shares and retaining 198,000 shares valued at $4.843 million. This move coincides with major insider selling from HP's CEO and another insider, who collectively decreased their ownership significantly. Despite these reductions, HP reported Q2 revenue of $13.93 billion and EPS of $0.75, meeting estimates, and received a consensus analyst target of $28.67 with a ""Hold"" rating.",-0.210156,1.0
20251117T090000,New Collaboration Between MTC and HP Supports UK Additive Manufacturing Growth,"The Manufacturing Technology Centre (MTC) has partnered with HP Inc. as a new Tier 2 member to advance Metal Binder Jetting technology in the UK. This collaboration aims to foster industry and academic cooperation, making scalable and cost-effective additive manufacturing solutions more accessible. The partnership aligns with broader UK government initiatives to support additive manufacturing, including significant investments in defence and aerospace applications.",0.348269,1.0
20251117T113627,"PNC Financial Services Group Inc. Sells 12,752 Shares of HP Inc. $HPQ","PNC Financial Services Group Inc. reduced its stake in HP Inc. by 3.1% in the second quarter, selling 12,752 shares and now holding 395,099 shares valued at $9.66 million. Concurrently, HP's CEO Enrique Lores significantly decreased his personal holdings by selling over 34,000 shares, while other institutional investors like Nuveen, Invesco, and AustralianSuper increased their positions. Despite mixed institutional activity, analysts maintain a ""Hold"" rating for HP with an average price target of $28.67, above its current trading price.",0.048848,1.0
20251118T152123,"Universal Beteiligungs und Servicegesellschaft mbH Sells 232,836 Shares of HP Inc. $HPQ","Universal Beteiligungs und Servicegesellschaft mbH sold 232,836 shares of HP Inc., reducing its stake by 11.4% to 1,807,951 shares valued at approximately $44.22 million. Wall Street analysts generally hold a ""Hold"" rating on HP, with a consensus target price of $28.50. The article also details recent insider selling by HP's CEO and another insider, as well as the company's recent earnings performance and stock market metrics.",-0.05843,1.0
20251118T163626,Aceso Interactive Partners with HP to Deliver Scalable Patient Collaboration and Engagement Platform,"Aceso Interactive has partnered with HP, Inc. to integrate its Patient Care Platform and Pane of Glass™ toolkit with HP | Poly video collaboration solutions. This collaboration aims to provide healthcare providers with a seamless, interactive, and personalized patient engagement experience, enhancing clinical workflows and improving outcomes without the need for additional hardware. The combined solution is designed to deliver efficient virtual care connections, speed to value, and cost savings for health systems of all sizes.",0.493793,1.0
20251119T085905,HP Inc. $HPQ Shares Bought by Foundations Investment Advisors LLC,"Foundations Investment Advisors LLC significantly increased its stake in HP Inc. (NYSE:HPQ) by 188.7% during the second quarter, now owning 27,481 shares valued at $672,000. Other institutional investors like Global Trust Asset Management LLC and Quaker Wealth Management LLC also raised their holdings, while company insiders Anneliese Olson and CEO Enrique Lores sold substantial amounts of shares. HP Inc.'s stock performance shows a market capitalization of $21.24 billion, with analysts giving it an average ""Hold"" rating and a consensus price target of $28.50.",0.147038,1.0
20251119T112509,"Raiffeisen Bank International AG Sells 25,611 Shares of HP Inc. $HPQ","Raiffeisen Bank International AG reduced its stake in HP Inc. by 6.3% in the second quarter, selling 25,611 shares and now owning 382,068 shares valued at $9.37 million. This comes as HP's CEO and another insider also sold significant portions of their holdings, contributing to a low insider ownership of 0.38%. Despite these sales, institutional investors collectively own 77.53% of the stock, which is currently down 6.9% and has a consensus ""Hold"" rating from analysts.",-0.208962,1.0
20251120T173300,[Form 4] HP INC Insider Trading Activity,"HP Inc. President and CEO Enrique Lores reported the vesting of 159,983 performance-adjusted restricted stock units (PARSUs) on November 18, 2025. These PARSUs settled into HP common shares at an exercise price of $0, with 76,139 shares withheld to cover tax withholding at $22.71 per share. Following these transactions, Lores directly owned 83,847 HP shares and indirectly owned 888,908 shares.",0.035549,1.0
20251120T173500,[Form 4] HP INC Insider Trading Activity,"HP Inc.'s Chief Commercial Officer, David P. McQuarrie, reported equity award activity on November 18, 2025, involving the vesting of 29,671 performance-adjusted restricted stock units (PARSUs). Following the transactions, which included the withholding of 12,941 shares for tax purposes, McQuarrie directly owned 72,653 shares of HP common stock. This Form 4 filing details the changes in his beneficial ownership of HP Inc. securities.",0.010017,1.0
20251121T173800,HP Inc. (HPQ) Soars 6.24% on Strategic AI Partnership Ahead of Q4 Earnings,"HP Inc. (HPQ) saw its stock price surge by 6.24% due to a strategic AI partnership with SAMI Advanced Electronics to manufacture millions of AI-driven computers in Saudi Arabia by 2030, rather than its upcoming Q4 2025 earnings report. This move signals robust investor confidence in HP's long-term vision and its pivot into the artificial intelligence sector and new regional markets. While analyst sentiments are mixed, the market is primarily reacting to the optimistic forward guidance and potential for sustained growth in AI-integrated hardware.",0.190681,1.0
20251121T183200,"HP Inc. Soars on Landmark AI Manufacturing Partnership, Signaling Broader Market Confidence in AI Future","HP Inc. (NYSE: HPQ) saw a significant stock price surge of 6.24% to 6.94% on November 21, 2025, following the announcement of a strategic AI manufacturing partnership with SAMI Advanced Electronics. This collaboration aims to produce millions of AI-integrated computers in Saudi Arabia by 2030, targeting the enterprise market, and highlights HP's aggressive pivot into AI-driven manufacturing. The market's positive reaction underscores strong investor confidence in HP's long-term AI vision and reflects a broader global trend of accelerated investment in the AI ecosystem.",0.632777,1.0
20251122T132121,"Vanguard Group Inc. Buys 2,395,056 Shares of HP Inc. $HPQ","Vanguard Group Inc. increased its stake in HP Inc. by 1.9%, acquiring an additional 2,395,056 shares, bringing its total ownership to 126,536,318 shares valued at approximately $3.095 billion. The article also highlights HP's recent Q2 earnings, revenue beats, Q4 2025 guidance, and significant insider selling by the CEO and another executive. Analyst ratings for HP are varied, with a consensus ""Hold"" rating.",0.237514,1.0
20251122T143605,HP Inc. (HPQ) Stock Price | Live Quotes & Charts | NYSE,"This article provides live quotes and charts for HP Inc. (HPQ) stock, showing its current price and daily gain. It also includes sections for analyst ratings and earnings, though specific data for these categories is currently unavailable. The page features an invitation for users to sign up for free trade alerts.",0.249783,1.0
20251123T030601,HP Inc. downgraded to Underweight from Equal Weight at Morgan Stanley,"Morgan Stanley downgraded HP Inc. (HPQ) from Equal Weight to Underweight due to anticipated structural headwinds in the personal computer (PC) market and potential impacts from AI. The firm also lowered its price target for HPQ to $28 from $30. Despite a temporary boost from Microsoft's Windows 11 refresh cycle, Morgan Stanley expects the PC market's recovery to be limited and AI's benefits to HP in the near term to be outweighed by other factors.",-0.285393,1.0
20251123T083614,HP Inc. $HPQ Shares Sold by Bahl & Gaynor Inc.,"Bahl & Gaynor Inc. significantly reduced its stake in HP Inc. ($HPQ) by 95.6% in the second quarter, selling over 2.5 million shares. Despite this, other institutional investors, such as Plato Investment Management Ltd and Fiduciary Financial Group LLC, increased their holdings. The article also details HP's recent financial performance, analyst ratings, and insider trading activities.",-0.203157,1.0
20251124T113200,HP Inc. (HPQ) call put ratio 1 call to 2.7 put into quarter results,"HP Inc. (HPQ) is showing a call-to-put ratio of 1 call to 2.7 puts ahead of its quarter results, expected after the bell on November 25. The implied volatility for November 28 weekly call options is 90, and for December is 52, significantly higher than its 52-week range. The article also provides current stock information including the price, analyst rating, dividend yield, and EPS growth.",-0.33061,1.0
20251124T121546,"Mediolanum International Funds Ltd Acquires 35,290 Shares of HP Inc. $HPQ","Mediolanum International Funds Ltd significantly increased its stake in HP Inc., acquiring an additional 35,290 shares to hold a total of 96,962 shares valued at approximately $2.402 million. This move is part of broader institutional investor activity in HPQ, with Vanguard and Nuveen also making substantial investments, even as company insiders have been selling shares. The article also provides a detailed overview of HP's latest financial performance, analyst ratings, and stock performance metrics.",0.146214,1.0
20251125T214100,"HP to slash up to 6,000 jobs by 2028 in massive AI transformation push","HP has announced plans to cut between 4,000 and 6,000 jobs by the end of 2028 as part of a significant AI transformation initiative aimed at generating $1 billion in cost savings. These layoffs, which could impact up to 10% of its workforce, are intended to redesign business strategies using AI to enhance productivity, security, and flexibility for customers. The company also reported $55.3 billion in annual revenue for fiscal 2025.",-0.207489,1.0
20251125T231724,HP puts a number on how many jobs it'll cut due to AI,"HP announced plans to cut between 4,000 and 6,000 jobs by the end of fiscal 2028, citing AI-driven initiatives as the reason. The company expects to save approximately $1 billion through these workforce reductions and other productivity measures, though it forecasts incurring around $650 million in restructuring costs. This move is part of HP's strategy to enhance customer satisfaction, innovation, and productivity through increased AI adoption.",-0.255205,1.0
20251126T090828,HP Inc. Reports Fiscal 2025 Full Year and Fourth Quarter Results,"HP Inc. announced its fiscal 2025 full-year and fourth-quarter results, reporting a net revenue of $55.3 billion for the full year, a 3.2% increase from the prior year, and a fourth-quarter net revenue of $14.6 billion, up 4.2%. The company returned $1.9 billion to shareholders in fiscal 2025 and increased its quarterly dividend to $0.30 per share. HP also unveiled a company-wide initiative aimed at generating approximately $1 billion in gross run rate cost savings by the end of fiscal 2028, involving a reduction of 4,000-6,000 employees.",0.165096,1.0
20251126T155800,"HP, Inc. price target lowered to $26 at TD Cowen on memory cost impact","TD Cowen lowered its price target for HP, Inc. (NYSE:HPQ) to $26 from $28 while maintaining a Hold rating, citing memory price increases and supply scarcity impacting HP's fiscal year 2026 earnings per share outlook. Despite a $1 billion cost restructuring plan and positive aspects like growth segments and AI PCs, the free cash flow target remains flat year-over-year and below previous estimates. This comes after HP exceeded Q4 2025 earnings and revenue expectations.",-0.285635,1.0
20251127T053606,HP Inc. Reports Mixed Fiscal 2025 Results,"HP Inc. reported mixed financial results for fiscal 2025, with net revenue increasing to $55.3 billion and fourth-quarter revenue rising to $14.6 billion. Despite revenue growth, the company experienced a decline in GAAP and non-GAAP diluted net EPS. HP also announced a cost-saving initiative targeting $1 billion by fiscal 2028, involving a significant reduction in global headcount, and expects free cash flow between $2.8 billion and $3.0 billion in fiscal 2026.",0.094802,1.0
20251127T172824,JPMorgan Chase & Co. Cuts HP (NYSE:HPQ) Price Target to $25.00,"JPMorgan Chase & Co. lowered its price target for HP (NYSE:HPQ) from $30.00 to $25.00, maintaining a ""neutral"" rating, while other analysts offered mixed but generally cautious outlooks. This comes despite HP beating quarterly earnings and revenue expectations and setting positive FY 2026 guidance, as the stock traded below many analyst targets. Significant insider selling by CEO Enrique Lores and other executives, drastically reducing their holdings, also occurred recently.",-0.126134,1.0
20251128T112219,"HP Inc. (NYSE:HPQ) Just Reported, And Analysts Assigned A US$25.88 Price Target","Following HP Inc.'s recent annual report, analysts have updated their forecasts, assigning a US$25.88 price target. Although revenues were roughly in line with estimates at US$55b, and statutory EPS at US$2.65, there's been a decline in sentiment evidenced by a cut to new EPS forecasts and a 7.9% drop in the average price target. Analysts expect 2026 revenues to be US$56.3b and statutory EPS to be US$2.75, which is roughly flat compared to the previous year.",-0.411539,1.0
20251128T113648,"HP Inc. (NYSE:HPQ) Just Reported, And Analysts Assigned A US$25.88 Price Target","HP Inc. recently reported its annual numbers, with revenues of US$55b and statutory EPS of US$2.65, generally in line with analyst estimates. Following these results, analysts have updated their forecasts, noting a decline in EPS projections and a 7.9% reduction in the average price target to US$25.88, reflecting a lower valuation estimate. Despite revenue forecasts remaining stable, the adjusted sentiment indicates potential challenges for HP Inc.'s growth compared to the broader industry.",-0.353126,1.0
20251129T123900,Here's What Analysts Think About Western Digital (WDC),"Analysts are bullish on Western Digital (WDC), reiterating Buy ratings and raising price targets due to strong performance and positive outlook for the hard disk drive (HDD) industry. Bank of America Securities and TD Cowen have increased price targets, with TD Cowen highlighting ""flawless"" results and extended business visibility into 2027. JPMorgan analysts also noted significant purchase orders extending through 2026, driven by increasing AI-related demand.",0.352735,0.609257
20251129T123900,Micron Technology (MU) Price Targets Raised by Analysts,"Analysts from Morgan Stanley, Rosenblatt, and Wells Fargo have raised their price targets for Micron Technology (MU) due to increasing demand for DRAM, driven by AI accelerators and HBM, and rising DRAM and NAND prices. The company's strong market position and solid execution were also cited as reasons for the increased optimism. Micron is noted as a leading semiconductor technology company in memory and storage solutions.",0.355175,0.598091
20251130T095950,"Grantham Mayo Van Otterloo & Co. LLC Sells 387,127 Shares of HP Inc. $HPQ","Grantham Mayo Van Otterloo & Co. LLC reduced its stake in HP Inc. by 25% in Q2 2025, selling 387,127 shares and now owning 1,162,713 shares valued at $28.44 million. Additionally, HP's CEO and an insider sold significant portions of their holdings, leading to a substantial decrease in their respective positions. Despite these insider sales, HP reported stronger-than-expected quarterly earnings, set positive FY2026 guidance, and increased its quarterly dividend to $0.30, resulting in a 4.9% annualized yield.",-0.188673,1.0
20251130T121902,"Skandinaviska Enskilda Banken AB publ Sells 34,674 Shares of HP Inc. $HPQ","Skandinaviska Enskilda Banken AB publ sold 34,674 shares of HP Inc. (NYSE:HPQ), reducing its stake by 4.4% and now owning 745,559 shares. This comes amidst other institutional investor activity and significant insider selling by Anneliese Olson and CEO Enrique Lores. HP recently raised its quarterly dividend and reported a slight EPS beat with optimistic FY26 guidance.",0.071602,1.0
20251201T112852,Level Four Advisory Services LLC Increases Stock Position in HP Inc. $HPQ,"Level Four Advisory Services LLC significantly increased its stake in HP Inc. by 30.4%, bringing its total holdings to 104,487 shares valued at $2.56 million. This increase occurred despite substantial sales by HP's CEO and another insider, who collectively own a minimal percentage of the company's stock. HP also announced a dividend increase and provided optimistic FY2026 EPS guidance, while analysts maintain a consensus ""Hold"" rating with an average price target of $25.69.",0.119396,1.0
20251201T132131,Railway Pension Investments Ltd Has $36.88 Million Stock Holdings in HP Inc. $HPQ,"Railway Pension Investments Ltd reduced its stake in HP Inc. by 1.1% in Q2, bringing its holdings to $36.88 million. Institutional investors now own 77.53% of HP, with equity analysts maintaining a ""Hold"" consensus and an average target price of $25.69. The company recently reported a slight beat on quarterly EPS and revenue, raised its quarterly dividend to $0.30, and disclosed significant insider stock sales.",0.045381,1.0
20251202T183640,HP Inc. call volume above normal and directionally bullish,"HP Inc. has experienced unusually high call option trading volume, indicating a bullish sentiment towards the company. The trading activity includes significant volume in specific weekly call options and an increase in implied volatility, with earnings anticipated in February.",0.23757,1.0
20251202T185900,"HP Inc. (NYSE: HPQ) officer details RSU vesting, 3,854 shares settled","HP Inc. officer Ketan M. Patel reported the vesting of 3,854 Restricted Stock Units (RSUs) on November 29, 2025. These shares were acquired at an exercise price of $0, with 1,334 shares subsequently withheld by HP at $24.42 each to cover tax obligations. Following these transactions, Patel directly holds 46,917 HP common shares.",0.01259,1.0
20251203T103404,HP’s Strategic Pivot: Dividend Boost Amidst Deep Cost Cuts,"HP Inc. is implementing a strategic pivot, raising its quarterly dividend to $0.30 per share for a forward yield of 4.75%, despite a backdrop of significant workforce reductions. The company plans to eliminate 4,000 to 6,000 positions by fiscal 2028, aiming for $1 billion in annual savings, while also forecasting lower-than-expected profits for the coming period. This dual-pronged strategy of shareholder return and aggressive cost-cutting has led to mixed reactions from analysts, with some revising price targets downwards.",-0.259575,1.0
20251203T113404,HP’s Strategic Pivot: Dividend Boost Amidst Deep Cost Cuts,"HP Inc. announced a significant increase to its quarterly shareholder dividend to $0.30 per share, resulting in an attractive forward dividend yield of approximately 4.75%. This move comes amidst aggressive cost-cutting initiatives, including plans to eliminate 4,000 to 6,000 positions by fiscal year 2028, and a profit forecast that fell below market expectations, leading to downward revisions in price targets by financial institutions like Argus Research and JPMorgan. The company faces the challenge of whether the enhanced dividend can sustain investor confidence despite the near-term headwinds and extensive restructuring.",-0.055432,1.0
20251204T095204,Groupe la Francaise Raises Stock Holdings in HP Inc. $HPQ,"Groupe la Francaise significantly increased its stake in HP Inc. by 67.6% in the second quarter, bringing its total holdings to 133,550 shares valued at $3.25 million. Several other hedge funds also made moves in HPQ stock, demonstrating considerable institutional investor interest, with 77.53% of the company's stock owned by institutional investors. HP Inc. reported strong Q3 earnings, beating analyst estimates, and increased its quarterly dividend, while facing varied analyst ratings from ""Strong Buy"" to ""Sell"".",0.194039,1.0
20251204T120814,HP Inc. $HPQ Shares Bought by Panagora Asset Management Inc.,"Panagora Asset Management Inc. significantly increased its stake in HP Inc. by 1,295% in Q2, bringing its total holdings to 631,996 shares worth approximately $15.46 million. This contradicts recent insider selling by CEO Enrique Lores and Anneliese Olson, who drastically reduced their stock ownership. Despite a ""Hold"" consensus rating from analysts and a trimmed price target, HP has raised its quarterly dividend to $0.30 per share and provided positive FY26 EPS guidance.",0.091277,1.0
20251205T110829,Norges Bank Takes Position in HP Inc. $HPQ,"Norges Bank has acquired a new position in HP Inc. (NYSE:HPQ), purchasing over 3.7 million shares valued at approximately $91.7 million, giving it a 0.40% stake in the company. Other institutional investors have also adjusted their holdings, with many increasing their positions. The article details HP's recent financial performance, including its earnings report and an increased quarterly dividend, alongside recent insider transactions and analyst ratings.",0.267178,1.0
20251205T161634,Six Trends To Watch Out for in 2026 from HP Wolf Security,"HP Wolf Security experts outline six cybersecurity trends predicted for 2026, focusing on evolving threats and necessary defenses. These include the rise of cookie theft, AI-driven cybercrime, physical attacks on devices, and increased attention to IoT and print security. The report also highlights the growing importance of quantum resistance and a shift towards data-centric security models for identity and provenance in enterprise settings.",-0.117084,1.0
20251208T101700,"Intel, Adobe and these other ‘AI loser’ stocks could get left behind in the next phase of the tech boom","Wedbush Securities has identified 12 tech companies as ""AI losers,"" deeming them most vulnerable to business model disruptions by the AI revolution. The list includes major players like Intel, Adobe, Qualcomm, and Uber, with analysts warning they could be ""left in the dust"" if they don't rapidly adopt AI technology. Rising memory costs due to AI demand are also expected to squeeze margins for hardware makers like Intel.",-0.336025,0.712422
