time_published,title,summary,overall_sentiment_score,relevance_score
20221128T090200,Here’s why I will never buy an HP printer again (this time for sure),"The author recounts an experience with his HP printer, which stopped working because his credit card on file for the ""Instant Ink"" subscription had expired. Upon attempting to cancel the subscription, he discovered that all previously paid-for ink cartridges would be rendered useless. This led him to renew his subscription and vow never to purchase an HP printer again due to their restrictive practices.",-0.614911,0.941196
20221206T052304,Why Did HP Kill off its Full-Color 3D Printer?,"This article investigates the mysterious discontinuation of HP's full-color Jet Fusion 580 3D printer, despite its technical efficiency and potential in niche markets like orthotics and prosthetics. The author suggests reasons such as internal company disconnects, perceived competition between product lines, and a lack of vision from leadership focused on 2D printing. The piece argues that HP fumbled a valuable product with significant revenue potential and impact on humanity.",-0.322468,1.0
20221206T112500,Adobe Cuts 100 Jobs Concentrated in Sales as Tech Tightens Belt,"Adobe Inc. has eliminated approximately 100 jobs, primarily in sales, as part of a broader trend of tech companies reducing expenses through staff cuts. While some affected employees were offered alternative roles within the company, Adobe's workforce reduction is significantly smaller compared to the thousands of jobs cut by other tech giants like Amazon and Meta. The San Jose-based software company had over 28,700 employees by the end of its fiscal third quarter.",-0.152966,0.634845
20221207T052304,Top 4 Most Rugged Laptops from HP | HP® Tech Takes Australia,"This article highlights HP's most rugged laptops, detailing the extensive ""Total Test Process"" (TTP) that HP uses to ensure durability. It describes various stress tests laptops undergo, like dust, humidity, temperature, and shock tests. The article then pinpoints the HP ZBook Studio 16 Mobile Workstation as the most rugged overall, along with the HP Chromebook x2 as the most rugged 2-in-1, the HP EliteBook x360 for business, and a specific HP Chromebook model for students.",0.462472,1.0
20221207T121300,Micron Delivers the World's Most Advanced Client SSD Featuring 232-Layer NAND Technology,"Micron announced the shipment of its 2550 NVMe SSD to global PC OEM customers, marking it as the world's first client SSD to use NAND with over 200 layers (232-layer NAND). This new SSD offers significant performance improvements and power savings, extending battery life for laptops and desktops. The Micron 2550 SSD is available in various form factors and capacities, providing flexibility for system designers.",0.336045,0.680943
20221208T082900,A dip in Alder Lake with an HP Elitebook is spoiled by avoidable mistakes,"The HP Elitebook 1040 x360 g9, featuring an Intel Alder Lake CPU, offers solid performance and thoughtful additions but is marred by several design flaws and software issues. Reviewer Simon Sharwood notes its speed in benchmarks and daily tasks but criticizes the poor keyboard, inconvenient port placement, useless tablet mode, and excessive pre-installed ""nagware."" Despite its processing power, the laptop ultimately feels uninspired and fails to deliver a ""fresh perspective"" often sought in the ""Desktop Tourism"" series.",-0.121609,0.972919
20221214T052304,Our 5 best touch screen laptops,"This article from HP details the benefits of touch screen laptops and lists HP's top 5 recommendations. It explains how touch screens work, differentiating between capacitive and resistive types, and highlights models like the HP ENVY x360, Pavilion x360, Chromebook x360, Elite x360, and ENVY 16, emphasizing their features for various user needs. The piece concludes by encouraging readers to consider their personal requirements and budget when choosing a touch screen laptop.",0.490243,1.0
20221215T052304,HP Metal Jet: Growing momentum and new applications as Binder Jetting comes of age,"This article details the commercial launch and growing adoption of HP's Metal Jet S100 Binder Jetting system. It covers the journey from its 2018 unveiling, highlighting HP's strategies to overcome market challenges and push for industrial-scale manufacturing, moving beyond traditional hardware sales to a service-focused model. The piece showcases various industrial applications and customer success stories, emphasizing the technology's capability to deliver quality, productivity, and cost-effectiveness in metal Additive Manufacturing.",0.381003,1.0
20221217T052304,What Is HP Smart Friend a Complete Overview | HP® Tech Takes,"HP SmartFriend is a subscription-based tech support service offering 24/7 access to experts for troubleshooting, maintenance, and setup of tech devices from any brand. It provides various plans, including individual, family, and a one-time fee option, covering services like software installation, network troubleshooting, virus removal, and PC migration. The service aims to save users time and money compared to traditional repair shops by offering affordable, reliable, and accessible remote assistance.",0.211874,1.0
20221220T052304,ENVY Laptops: A Complete Review,"This article provides a comprehensive review of HP ENVY laptops, highlighting their blend of style and functionality. It details key features such as design, performance specifications, entertainment capabilities, connectivity options, battery life, and security features. The review also offers a closer look at specific models like the 13-inch, 15-inch, and x360 convertible HP ENVY laptops, helping consumers choose the best fit for their needs.",0.340327,1.0
20221221T052304,5 Best HP Laptops for Small Business,"This article identifies five top HP laptop models best suited for small business needs, categorizing them by their strengths. It highlights the HP Z Mobile Workstation for graphics and performance, the HP EliteBook for versatility and endurance, the HP Chromebook for dependability and web-centric tasks, the HP ProBook for extensive configurability, and the HP Mobile Thin Client for affordability and security. The article helps business owners choose a laptop based on their specific work environment, mobility requirements, and processing needs.",0.341859,1.0
20221222T052304,3dpbm’s guided tour of HP’s booth at Formnext 2022,"This article provides a detailed tour of HP's booth at Formnext 2022, highlighting the company's advancements in both plastic and metal 3D printing. It covers HP's new white plastic printing capabilities and the modular MetalJet S100 system, along with insights from Tim Weber and Devin Mourey regarding technological innovations and applications in various industries. The piece illustrates how major OEMs like John Deere and Schneider Electric are using HP's additive manufacturing for production and how consumer brands like Cobra Golf leverage it for product iteration.",0.435515,1.0
20221229T051053,What Were the 3D Printing Trends in 2022?,"The 3D printing market in 2022 saw significant trends including continued industrialization and a focus on sustainability, with the Additive Manufacturing Green Trade Association (AMGTA) expanding rapidly. Consolidation through mergers, acquisitions, and partnerships was a major theme, exemplified by the UltiMaker merger and companies seeking end-to-end solutions. The year also experienced market disruptions from the war in Ukraine and supply chain issues, alongside growing importance of automation, software, and the rise of binder jetting technology for mass production of metal parts.",0.237348,0.613031
20230103T042318,HP class action claims website use ‘session replay’ technology to spy on customers,"A class action lawsuit has been filed against HP Inc., alleging that the company uses ""session replay"" technology on its website to spy on customers' interactions. The plaintiff, Emir Balanzar, claims this technology violates federal and state wiretap laws and constitutes false advertising, as HP did not disclose its full data collection practices. The lawsuit seeks damages and injunctive relief, suggesting that HP's advertised purpose for the software contradicts its alleged spying capabilities.",-0.701408,1.0
20230103T043646,"NVIDIA Ada Lovelace Breaks Energy-Efficiency Barrier, Supercharges 170+ Laptop Designs for Gamers and Creators","NVIDIA has announced its new GeForce RTX 40 Series laptops, powered by the Ada Lovelace GPU architecture, which promise significant generational leaps in performance and power efficiency. These laptops, featuring DLSS 3 and fifth-generation Max-Q technologies, offer up to 4x performance for gamers and blazing-fast acceleration for creators, with models ranging from high-end flagships to more accessible options. The new technology also enables powerful 14-inch laptops and boosts the NVIDIA Studio ecosystem for over 110 million creators.",0.285525,0.628524
20230104T042318,HP at CES 2023: Leading in Hybrid and Gaming Experiences,"At CES 2023, HP Inc. announced a new line-up of products and solutions aimed at enhancing hybrid work and gaming experiences, focusing on sustainability. Key introductions include the HP Dragonfly Pro for freelancers, the Poly Voyager Free 60 Series earbuds, new HP E-Series monitors, and OMEN Gaming Hub with NVIDIA GeForce NOW integration. HP also emphasized its commitment to sustainability by incorporating unique recycled materials like coffee grounds and ocean-bound plastics into its new PCs and peripherals.",0.323437,1.0
20230104T042318,HP launches PCs for hybrid workers with 'world-first' dual-camera setups,"HP unveiled new PCs at CES 2023, specifically designed for hybrid workers, featuring what it calls a 'world-first' dual-camera setup that allows for simultaneous video streams and camera switching. These devices, including the HP Dragonfly G4, HP EliteBook 1040 G10, and HP Elite x360 1040 G10, are equipped with Intel 13th Gen processors and aim to enhance productivity and connectivity in flexible work environments. Additionally, HP introduced the Dragonfly Pro Chromebook and HP Dragonfly Pro targeted at users needing continuous connectivity, powerful cameras, and dedicated support for demanding workloads, appealing to the growing freelance community.",0.213181,1.0
20230112T042617,"IDC, Gartner: 2022 PC Demand Dropped To Its ‘Lowest Level In Years’","PC demand in 2022 dropped significantly to its lowest level in years, according to reports from IDC and Gartner. This decline was attributed to global recession, inflation, higher interest rates, and consumers already owning newer PCs purchased during the pandemic. The business market too saw a decline as enterprise buyers extended PC life cycles and delayed purchases, with growth not expected until 2024.",-0.326297,0.714117
20230117T042318,5 Best HP Laptops For Drawing | HP® Tech Takes,"This article identifies key features for good drawing laptops, including color-accurate touchscreens, powerful processors for design software, and sensitive pens. It then reviews five HP laptop models—HP ENVY x360, HP Spectre x360, HP Pavilion x360, HP EliteBook x360, and HP ZBook x2 G4—highlighting their specifications and suitability for artists with diverse needs and budgets. The article aims to guide artists in choosing the best HP laptop for their creative work, emphasizing performance, screen quality, and portability.",0.397659,1.0
20230119T165900,HP Inc. stock underperforms Thursday when compared to competitors,"HP Inc. stock (HPQ) fell by 2.07% to $26.96 on Thursday, marking its sixth consecutive day of losses. This decline occurred during a broader market downturn and resulted in HP Inc. underperforming against competitors like Apple Inc. (AAPL), which saw a slight gain, although Dell Technologies Inc. (DELL) also experienced a loss.",0.015109,0.300356
20230121T080500,HP Inc. Stock: Undervalued With Big Share Buybacks (NYSE:HPQ),"HP Inc. (HPQ) is presented as an undervalued stock generating strong cash flows from its mature business. The company is actively returning capital to shareholders through significant share buybacks and dividends, while also focusing on efficiency improvements. The article suggests HPQ is attractively priced with a low P/E ratio, making it a potentially appealing investment.",0.453934,1.0
20230131T042318,HP Laptop Buying Guide | HP® Tech Takes,"This HP Laptop Buying Guide categorizes various HP laptop models based on their primary use, helping consumers choose the best device for their needs. It covers gaming laptops like the HP OMEN series, entry-level options such as the Chromebook and Stream, powerful business workstations including the EliteBook and ZBook lines, and versatile convertible laptops like the HP Spectre x360 and ENVY x360. The guide emphasizes matching laptop features to user requirements for an optimal computing experience.",0.274569,1.0
20230201T032528,Reebok and Botter unveil vibrant 3D-printed trainers informed by seashells,"Reebok and Dutch brand Botter collaborated to create vibrant 3D-printed trainers with ridged soles, inspired by the murex sea snail. Produced by HP using Multi Jet Fusion technology, the ""Reebok x Botter Sneaker"" was developed in just 15 days and hand-painted to complement Botter's latest collection. This innovative footwear highlights the speed and design freedom offered by 3D printing in the fashion industry.",0.418359,1.0
20230202T032528,HP Smart Tank Printers Review,"The HP Smart Tank printer differentiates itself with an affordable, efficient, and sustainable approach to printing, offering up to two years of ink right out of the box through a refillable tank system. It's designed for high-volume printing needs, providing benefits like fast, quality prints, enhanced security, ease of use, and eco-friendly construction. The article details how these printers work, their benefits, and recommends specific models like the HP Smart Tank 7301 All-in-One and HP Smart Tank 6001 All-in-One for various user groups, from families to small business owners.",0.448488,1.0
20230210T032528,Best Laptops under $1000 from HP Australia,"This article identifies the best HP laptops available for under $1000 in Australia, suitable for various everyday tasks. It highlights key features to consider when purchasing a budget laptop, such as processor, RAM, build quality, and screen size. The article then details five specific HP models: the HP Chromebook x360, HP Laptop 15s, HP Laptop 14s, HP Pavilion x360 14, and HP Pavilion Laptop 14, outlining their specifications and ideal use cases.",0.433493,1.0
20230214T032528,HP PageWide C550 Press – Sheet Fed Digital Press for Printing Corrugated Boxes,"The HP PageWide C550 Press is a sheet-fed digital press designed for printing corrugated boxes, offering high-volume production with digital post-print flexibility. It focuses on reducing manufacturing costs, increasing capacity, and achieving offset print quality using HP's true water-based inks for sustainability. The press incorporates advanced technologies like an innovative top feeder, virtual belt, and specialized print heads to ensure consistent, high-quality output for various packaging applications, including non-contact food packaging.",0.44822,1.0
20230215T032528,Star product: HP PageWide Advantage 2200,"The HP PageWide Advantage 2200 is a new, compact single-engine duplex CMYK inkjet web press designed for high productivity, versatility, and offset-class print quality, particularly for commercial print applications. It features a unique 'single-arch' configuration, HP's High Definition Architecture printheads, and water-based Brilliant Inks for various paper types. HP emphasizes its modular design, ease of use, and pay-as-you-go consumables-based pricing model, with several installations already completed worldwide.",0.74154,1.0
20230225T032528,HP sees long-term benefits in Chinese businesses,"HP has reiterated its commitment to long-term growth in China, viewing the country as both a crucial market and an essential part of its global supply chains. Despite reports of other US PC makers shifting production, HP has no plans to move its supply chains out of China, planning to increase investment and deepen local partnerships. The company highlights its significant presence in China, including design centers and production bases, which contribute to its global strategy.",0.447994,1.0
20230301T023509,HP CEO Lores: Hybrid Work Is ‘Driving Innovation Across Our Portfolio’,"HP CEO Enrique Lores stated that hybrid work is a long-term trend fueling innovation across their portfolio, with their hybrid systems business more than doubling year over year. Despite a general economic downturn and weakening corporate demand impacting PC sales, the company maintains its fiscal year outlook and expects to achieve significant cost savings. HP is also expanding its subscription services and investing in areas like AI and professional workstations.",-0.058761,0.959767
20230307T023508,Smaller Oregon companies looking for semiconductor funding,"Oregon lawmakers are preparing to allocate $200 million to attract federal semiconductor funding by supporting local companies and universities. While much attention has been on large fabrication plants, a network of smaller firms like Inpria and HP Inc. in Corvallis also contribute significantly to chip manufacturing. State Representative Janelle Bynum emphasized the need for a diverse workforce and better return on investment in the semiconductor industry, advocating for varied educational paths from apprenticeships to advanced degrees.",0.191253,1.0
20230310T023508,HP Updates Its Printers to Only Work With Official Ink Cartridges,"HP has released software updates that prevent some of its printers from functioning with third-party ink cartridges, forcing customers to use official HP ink. This decision has sparked outrage, with HP citing ""dynamic security"" for maintaining quality and protecting intellectual property. The company has faced legal repercussions for similar actions in the past, including lawsuits and fines.",-0.337156,1.0
20230312T023509,HP Under Fire For Blocking Third-Party Ink Cartridges Again,"HP is once again facing criticism for implementing firmware updates that prevent its printers from using third-party ink cartridges. This issue, which stems from the company's ""Dynamic Security"" policy, forces consumers to use HP-branded cartridges by rejecting those with non-HP chips. The practice has drawn ire from regulatory bodies and parallels previous settlements in the EU and USA regarding similar actions by the company.",-0.415214,1.0
20230327T023508,Stacy Wolff—Head of Design and Sustainability at HP Inc.—named this year's laureate of the American Prize for Design for 2023,"Stacy Wolff, Head of Design and Sustainability at HP Inc., has been awarded the American Prize for Design for 2023, America's highest design honor. The Chicago Athenaeum and The European Centre selected Wolff for his instrumental role in driving design innovation and sustainable impact at HP, transforming design into a strategic function. His work includes the multi-award-winning HP Spectre, Dragonfly, Elite, Envy, and Pavilion product lines, with a strong focus on merging cutting-edge technology with customer insights and climate responsibility.",0.491948,1.0
20230327T023509,Poly Studio X Family of Android-Based Video Bars are Now Certified for Google Meet,"HP announced that its Poly Studio X family of Android-based video bars are now certified for Google Meet, enabling organizations to leverage Poly's innovative room solutions. This certification guarantees compatibility and provides a seamless native experience with the Google Meet app built-in, simplifying setup and fostering efficient collaboration with advanced audio and video features like Poly DirectorAI and NoiseBlockAI. The Poly Studio X portfolio, including the X30, X50, and X70, offers solutions for various meeting space sizes, ensuring investment protection and continuous growth within the Google ecosystem.",0.457419,1.0
20230329T023509,"HP To Unify Services Into Workforce Central, New Way For Partners To Upsell","HP announced its plan to consolidate over 64 services for commercial PCs, printers, and other devices into a new cloud-based platform named Workforce Central. Scheduled to debut in the summer, this initiative aims to increase services revenue and provide channel partners with new upsell opportunities by allowing them to manage HP services from a single dashboard and integrate them into their operations. The platform will offer a freemium model and tiered pricing, with HP emphasizing that partners will have clear opportunities to generate revenue.",0.425419,1.0
20230330T023509,HP looks to lead with hybrid work collaboration and productivity portfolio,"HP is introducing new products and solutions to enhance hybrid work experiences for companies and employees, addressing challenges like sub-optimal technology and reluctance to return to the office. The expanded HP Presence features across their commercial PCs and collaborations with Poly aim to create seamless collaboration and productivity, emphasizing the importance of technology for thriving in a hybrid environment.",0.411958,1.0
20230403T014249,3 Best Desktop Computers for Business from HP India,"This article identifies and reviews the three best HP desktop computers for business use: the HP Workstation Z4 G4 Tower, the HP Z1 G9 Tower Desktop PC, and the HP Z2 Mini G9 Workstation Wolf Pro Security Edition. It outlines key features to consider when purchasing a business desktop, including form factor, processor, graphics, memory, storage, and security. The article emphasizes that the ideal business computer depends on specific needs like raw processing power, upgradability, or a compact design.",0.299374,1.0
20230412T014249,What is Thunderbolt 4? Is it the same as USB-C?,"Thunderbolt 4 is the latest iteration of the Thunderbolt interface, offering flexible connectivity and fast data transfer speeds for connecting multiple devices and displaying content in high resolutions. While physically identical to USB-C ports, Thunderbolt 4 has stricter certification requirements, ensuring consistent 40 Gbps bandwidth, support for dual 4K or single 8K monitors, and mandatory 100W power delivery. This makes it a superior choice for professionals and gamers requiring high performance and versatile connectivity, distinguishing it significantly from the less regulated USB-C standard.",0.446167,0.801013
20230415T014249,3 Best HP Pavilion Laptops For Entertainment | HP® Tech Takes,"This article outlines the key features to consider when choosing an entertainment laptop, focusing on display size, audio, storage, memory, and graphics. It then presents three top HP Pavilion laptop models—the Pavilion x360, Pavilion 15, and Pavilion Gaming laptop—highlighting their specifications and suitability for various entertainment needs. The guide aims to help users find a budget-friendly and high-performance device for gaming, streaming, or general multimedia consumption.",0.213702,1.0
20230419T014249,Cequence Security welcomes HP Pathfinder and Prosperity7 as new investors,"Cequence Security Inc., an API security startup, has announced strategic investments from Hewlett-Packard Pathfinder and Prosperity7 Ventures. The company's platform protects web, mobile, and API applications from malicious bot attacks and is designed to secure an estimated $9 trillion in assets among Fortune 500 companies. While the investment amounts were not disclosed, Cequence Security had previously raised over $100 million from various investors.",0.208445,0.837902
20230421T014249,Why you should consider going green with your gadgets this Earth Day and every day,"This article highlights the urgent need for sustainable practices in the electronics industry due to the massive increase in packaging waste. HP is presented as a leader in this shift, adopting a ""circularity-first"" approach to packaging design and material use, leveraging innovations like 3D printing to create more recyclable components and actively recycling used products. The article emphasizes that sustainability is an ongoing partnership between suppliers, producers, and consumers, requiring continuous effort beyond single initiatives.",0.419463,1.0
20230424T015606,Life and stock lessons from a billionaire value investor Mario Gabelli,"Mario J. Gabelli, a billionaire value investor, built his US$1.7 billion net worth from humble beginnings in the Bronx. This article highlights how his early life, marked by hard work and education instilled by his immigrant parents, shaped his successful 55-year career in investing, emphasizing his enterprising spirit from a young age.",0.286872,0.606031
20230501T165900,"HP Inc. stock rises Monday, outperforms market","HP Inc. (HPQ) stock increased by 0.84% to $29.96 on Monday, outperforming the broader market which saw the S&P 500 Index and Dow Jones Industrial Average fall. The rise occurred during a generally grim trading session. The company's stock closed significantly below its 52-week high of $40.79, achieved on June 1st.",0.392226,1.0
20230508T000000,HyperX Extends Las Vegas Esports Arena Naming Rights,"HyperX has renewed its exclusive naming rights agreement for Allied Esports’ HyperX Arena Las Vegas at Luxor Hotel and Casino. This multiyear arrangement ensures HyperX's continued prominent branding and partnership on co-branded experiences. The arena will also be retrofitted with HP Inc. OMEN PCs and monitors, while HyperX continues to supply gaming peripherals.",0.349692,0.845163
